{
  "$schema": "https://json-schema.org/draft/2020-12/schema",
  "$id": "urn:signal:schema:analysis:v5",
  "title": "Signal compact analysis v5",
  "type": "object",
  "additionalProperties": false,
  "required": ["schema_version", "provenance", "read", "signal_quality", "alignment", "variants", "warnings"],
  "properties": {
    "schema_version": { "const": "signal.analysis/v5" },
    "provenance": { "$ref": "#/$defs/provenance" },
    "read": { "$ref": "#/$defs/read" },
    "signal_quality": { "$ref": "#/$defs/signalQuality" },
    "alignment": { "$ref": "#/$defs/alignment" },
    "variants": { "type": "array", "items": { "$ref": "#/$defs/variant" } },
    "warnings": { "$ref": "#/$defs/warnings" }
  },
  "$defs": {
    "sha256": { "type": "string", "pattern": "^[0-9a-f]{64}$" },
    "interval": {
      "type": "object",
      "additionalProperties": false,
      "required": ["start", "end"],
      "properties": {
        "start": { "type": "integer", "minimum": 0 },
        "end": { "type": "integer", "minimum": 0 }
      }
    },
    "provenance": {
      "type": "object",
      "additionalProperties": false,
      "required": ["input", "reference", "configuration_sha256"],
      "properties": {
        "input": {
          "type": "object",
          "additionalProperties": false,
          "required": ["sha256"],
          "properties": { "sha256": { "$ref": "#/$defs/sha256" } }
        },
        "reference": {
          "type": "object",
          "additionalProperties": false,
          "required": ["name", "topology", "sha256"],
          "properties": {
            "name": { "type": "string", "minLength": 1 },
            "topology": { "enum": ["linear", "circular"] },
            "sha256": { "$ref": "#/$defs/sha256" }
          }
        },
        "configuration_sha256": { "$ref": "#/$defs/sha256" }
      }
    },
    "read": {
      "type": "object",
      "additionalProperties": false,
      "required": ["call_count", "trim"],
      "properties": {
        "call_count": { "type": "integer", "minimum": 1 },
        "trim": { "$ref": "#/$defs/interval" }
      }
    },
    "noisyRegion": {
      "type": "object",
      "additionalProperties": false,
      "required": ["calls", "samples", "minimum_primary_snr"],
      "properties": {
        "calls": { "$ref": "#/$defs/interval" },
        "samples": { "$ref": "#/$defs/interval" },
        "minimum_primary_snr": { "type": "number", "minimum": 0 }
      }
    },
    "signalQuality": {
      "type": "object",
      "additionalProperties": false,
      "required": ["noisy_regions"],
      "properties": {
        "noisy_regions": { "type": "array", "items": { "$ref": "#/$defs/noisyRegion" } }
      }
    },
    "alignment": {
      "type": "object",
      "additionalProperties": false,
      "required": ["orientation", "callable_bases", "identity", "unresolved_bases", "gap_opens", "reference_segments", "wraps_origin"],
      "properties": {
        "orientation": { "enum": ["forward", "reverse"] },
        "callable_bases": { "type": "integer", "minimum": 1 },
        "identity": { "type": "number", "minimum": 0, "maximum": 1 },
        "unresolved_bases": { "type": "integer", "minimum": 0 },
        "gap_opens": { "type": "integer", "minimum": 0 },
        "reference_segments": {
          "type": "array",
          "minItems": 1,
          "maxItems": 2,
          "items": { "$ref": "#/$defs/interval" }
        },
        "wraps_origin": { "type": "boolean" }
      }
    },
    "callProperties": {
      "type": "object",
      "properties": {
        "role": { "enum": ["supporting", "flanking"] },
        "index": { "type": "integer", "minimum": 0 },
        "position": { "type": "integer", "minimum": 1 },
        "ploc": { "type": "integer", "minimum": 0 },
        "primary": { "type": "string", "pattern": "^[ACGTN]$" },
        "ambiguity": { "type": "string", "pattern": "^[ACGTRYSWKMBDHVN]$" },
        "maximum_peak_height": { "type": "integer", "minimum": 0 },
        "relative_quality": { "type": "integer", "minimum": 0, "maximum": 255 }
      }
    },
    "supportingCallWithPosition": {
      "allOf": [
        { "$ref": "#/$defs/callProperties" },
        {
          "type": "object",
          "additionalProperties": false,
          "required": ["role", "index", "position", "ploc", "primary", "ambiguity", "maximum_peak_height", "relative_quality"],
          "properties": {
            "role": { "const": "supporting" }, "index": true, "position": true,
            "ploc": true, "primary": true, "ambiguity": true,
            "maximum_peak_height": true, "relative_quality": true
          }
        }
      ]
    },
    "supportingCallWithoutPosition": {
      "allOf": [
        { "$ref": "#/$defs/callProperties" },
        {
          "type": "object",
          "additionalProperties": false,
          "required": ["role", "index", "ploc", "primary", "ambiguity", "maximum_peak_height", "relative_quality"],
          "properties": {
            "role": { "const": "supporting" }, "index": true, "ploc": true,
            "primary": true, "ambiguity": true,
            "maximum_peak_height": true, "relative_quality": true
          }
        }
      ]
    },
    "flankingCall": {
      "allOf": [
        { "$ref": "#/$defs/callProperties" },
        {
          "type": "object",
          "additionalProperties": false,
          "required": ["role", "index", "position", "ploc", "primary", "ambiguity"],
          "properties": {
            "role": { "const": "flanking" }, "index": true, "position": true,
            "ploc": true, "primary": true, "ambiguity": true
          }
        }
      ]
    },
    "variantCore": {
      "type": "object",
      "additionalProperties": false,
      "required": ["position", "reference", "alternate", "kind", "calls"],
      "properties": {
        "position": { "type": "integer", "minimum": 1 },
        "reference": { "type": "string", "pattern": "^[ACGT]+$" },
        "alternate": { "type": "string", "pattern": "^[ACGT]+$" },
        "kind": { "enum": ["SNV", "INS", "DEL"] },
        "calls": { "type": "array", "minItems": 1 }
      }
    },
    "snvVariant": {
      "allOf": [
        { "$ref": "#/$defs/variantCore" },
        {
          "type": "object",
          "properties": {
            "kind": { "const": "SNV" },
            "calls": { "type": "array", "minItems": 1, "items": { "$ref": "#/$defs/supportingCallWithPosition" } }
          }
        }
      ]
    },
    "insertionVariant": {
      "allOf": [
        { "$ref": "#/$defs/variantCore" },
        {
          "type": "object",
          "properties": {
            "kind": { "const": "INS" },
            "calls": {
              "type": "array",
              "minItems": 1,
              "items": {
                "oneOf": [
                  { "$ref": "#/$defs/supportingCallWithoutPosition" },
                  { "$ref": "#/$defs/flankingCall" }
                ]
              },
              "contains": { "$ref": "#/$defs/supportingCallWithoutPosition" },
              "minContains": 1
            }
          }
        }
      ]
    },
    "deletionVariant": {
      "allOf": [
        { "$ref": "#/$defs/variantCore" },
        {
          "type": "object",
          "properties": {
            "kind": { "const": "DEL" },
            "calls": { "type": "array", "minItems": 1, "items": { "$ref": "#/$defs/flankingCall" } }
          }
        }
      ]
    },
    "variant": {
      "oneOf": [
        { "$ref": "#/$defs/snvVariant" },
        { "$ref": "#/$defs/insertionVariant" },
        { "$ref": "#/$defs/deletionVariant" }
      ]
    },
    "warnings": {
      "type": "object",
      "additionalProperties": false,
      "required": ["unresolved_primary_calls", "multi_channel_unresolved_calls", "excluded_variant_candidates"],
      "properties": {
        "unresolved_primary_calls": { "type": "integer", "minimum": 0 },
        "multi_channel_unresolved_calls": { "type": "integer", "minimum": 0 },
        "excluded_variant_candidates": { "type": "integer", "minimum": 0 }
      }
    }
  }
}
